NPR,npr.org,Media/News,Media/News,Public radio network providing independent news and cultural programming across various media platforms.,Partner,"The NPR and HundrED partnership is instrumental in promoting educational innovation and fostering global discussions on key educational issues. By leveraging their combined platforms, the collaboration aims to inspire and support educators in adopting effective educational practices, ultimately improving the quality of education worldwide.",Evidence dissemination,Kd,2019,To create a more informed public through rigorous reporting and storytelling.,Not specified,Recognized for its independent news and cultural programming.,1970," Washington, D.C., USA","1111 North Capitol St NE, Washington, DC 20002, USA",News and Cultural Programming,
HuffPost,huffpost.com,Media/News,Media/News,"An American news and opinion website and blog covering politics, entertainment, lifestyle, and more.",Partner,"The partnership between HuffPost and HundrED focuses on promoting and disseminating innovative educational practices worldwide. This collaboration aims to highlight impactful educational innovations and provide insights to educators, policymakers, and other stakeholders.",Evidence dissemination,Kd,2019,"To inform, inspire, and entertain through diverse and inclusive content.",Not specified,Known for its wide-ranging content and opinion pieces.,2005," New York, USA","770 Broadway, New York, NY 10003, USA",News and Opinion,
Scientific American,scientificamerican.com,Media/News,Media/News,"Covers important and exciting research in science, health, technology, environment, and society.",Partner,"The partnership between HundrED and Scientific American focuses on promoting and disseminating educational innovations that address contemporary challenges, particularly in the realm of science education. This collaboration aims to highlight innovative educational practices that can improve science literacy and counteract misinformation.",Evidence dissemination,Kd,2019,To advance knowledge and understanding by communicating important research in science,Not specified,Publishes authoritative articles by experts for a general audience.,1845," New York, USA","1 New York Plaza, New York, NY 10004, USA",Science and Technology Journalism,
Fast Company,fastcompany.com,Media/News,Media/News,"Focuses on business, technology, and design, featuring articles that highlight how companies and individuals innovate.",Partner,"The partnership between Fast Company and HundrED is focused on promoting educational innovation and providing valuable insights into transformative practices in education. By leveraging their combined platforms, the collaboration aims to inspire and support educators and policymakers in improving educational outcomes worldwide.",Evidence dissemination,Kd,2021,To inspire readers to think beyond traditional boundaries and embrace innovation.,Not specified,Recognized for its influential coverage of business and innovation.,1995," New York, USA","7 World Trade Center, 250 Greenwich St, New York, NY 10007, USA","Business, Technology, Design",
EdTech Hub,edtechhub.org,Research/Knowledge Hub,Research/Knowledge Hub,Supports evidence-based decision-making in education through rigorous research and innovation.,Partner,"The EdTech Hub and HundrED partnership is instrumental in promoting and scaling educational technology innovations, particularly in developing countries like Bangladesh. By focusing on evidence-based decision-making and global collaboration, the partnership aims to improve educational outcomes and address the global learning crisis through the effective use of technology. ",Evidence dissemination,Kd,2019,To empower decision-makers with evidence and tools to improve educational outcomes.,Using evidence to drive impactful educational decisions and innovations.,Contributed to better educational policies and practices through evidence-based research.,2019," Nairobi, Kenya","20-22 Wenlock Rd, Hoxton, London N1 7GU, UK",Educational Research and Innovation,
Helsinki Helsingfors,Not applicable,Geographic Location (City),Geographic Location (City),"Capital and largest city of Finland, known for its design, technology, and cultural contributions.",Partner,"The partnership between Helsinki and HundrED is a comprehensive effort to enhance educational practices through innovation and collaboration. By recognizing Helsinki as a forerunner in education, hosting global events, and implementing local innovative projects, this partnership aims to create a more dynamic and effective education system that can serve as a model for other cities worldwide.","Evidence dissemination, Implementation",KdI,2019,"To promote Helsinki as a leading city in design, technology, and culture.",Not specified,"Highly regarded for its contributions to design, technology, and cultural sectors.",1550," Helsinki, Finland","Pohjoisesplanadi 1, 00170 Helsinki, Finland","Design, Technology, Culture",
HundrED,About HundrED,Mission-based organization,Mission-based organization,We are a mission-driven organisation specialised in K-12 education innovation.,Core,,,,,"Access to quality education. The world is full of hardworking educators who are driving innovative, impactful, and scalable approaches in education. Our mission at HundrED is to give them the recognition and visibility they deserve.",We believe that with education innovations we can transform school systems and equip students with the skills to thrive as global citizens.,"At HundrED we believe that through identifying, amplifying, and facilitating the implementation of education innovations we can transform education systems and equip students with the skills to thrive as global citizens.",2017," Helsinki, Finland","Pohjoisesplanadi 33, 00100 Helsinki, Finland",,
